MariaDB [(none)]> use je0020;
Reading table information for completion of table and column names
You can turn off this feature to get a quicker startup with -A

Database changed
MariaDB [je0020]> create table Owner(
    -> driver_id varchar(20),
    -> name varchar(20),
    -> hometown varchar(40),
    -> birthyear int NOT NULL,
    -> PRIMARY KEY(driver_id),
    -> CHECK (2023-birthyear>=18)
    -> );
Query OK, 0 rows affected (0.018 sec)

MariaDB [je0020]> create table accident_record(
    -> report_number varchar(20),
    -> accident_year int,
    -> location varchar(20),
    -> driver_id varchar(20),
    -> PRIMARY KEY(report_number),
    -> FOREIGN KEY(driver_id) REFERENCES Owner(driver_id)
    -> );
Query OK, 0 rows affected (0.021 sec)

MariaDB [je0020]> create table compensation_record(
    -> report_number varchar(20),
    -> damage_amount int,
    -> FOREIGN KEY(report_number) REFERENCES accident_record(report_number)
    -> );
Query OK, 0 rows affected (0.023 sec)

MariaDB [je0020]> insert into Owner values('BR001','Liam','patna',2000);
Query OK, 1 row affected (0.004 sec)

MariaDB [je0020]> insert into Owner values('UP001','Noah','kanpur',1995);
Query OK, 1 row affected (0.002 sec)

MariaDB [je0020]> insert into Owner values('JH001','John','dhanbad',2000);
Query OK, 1 row affected (0.004 sec)

MariaDB [je0020]> insert into Owner values('UP002','Owen','banaras',1985);
Query OK, 1 row affected (0.002 sec)

MariaDB [je0020]> insert into Owner values('RJ001','Luke','kota',2001);
Query OK, 1 row affected (0.002 sec)

MariaDB [je0020]> insert into Owner values('MP001','Jack','ujjain',2003);
Query OK, 1 row affected (0.002 sec)

MariaDB [je0020]> insert into Owner values('CG001','Levi','raipur',2004);
Query OK, 1 row affected (0.002 sec)

MariaDB [je0020]> insert into accident_record values('R141',2010,'patna','BR001');
Query OK, 1 row affected (0.004 sec)

MariaDB [je0020]> insert into accident_record values('R146',2011,'kanpur','UP001');
Query OK, 1 row affected (0.002 sec)

MariaDB [je0020]> insert into accident_record values('R151',2015,'dhanbad','JH001');
Query OK, 1 row affected (0.004 sec)

MariaDB [je0020]> insert into accident_record values('R156',2017,'kota','UP001');
Query OK, 1 row affected (0.002 sec)

MariaDB [je0020]> insert into accident_record values('R161',2018,'raipur','UP002');
Query OK, 1 row affected (0.002 sec)

MariaDB [je0020]> insert into accident_record values('R162',2018,'gaya','RJ001');
Query OK, 1 row affected (0.002 sec)

MariaDB [je0020]> insert into accident_record values('R163',2020,'lucknow','MP001');
Query OK, 1 row affected (0.003 sec)

MariaDB [je0020]> insert into accident_record values('R164',2021,'kota','CG001');
Query OK, 1 row affected (0.002 sec)

MariaDB [je0020]> insert into accident_record values('R169',2022,'delhi','CG001');
Query OK, 1 row affected (0.002 sec)

MariaDB [je0020]> insert into compensation_record values('R141',20000);
Query OK, 1 row affected (0.004 sec)

MariaDB [je0020]> insert into compensation_record values('R146',200000);
Query OK, 1 row affected (0.002 sec)

MariaDB [je0020]> insert into compensation_record values('R151',300000);
Query OK, 1 row affected (0.004 sec)

MariaDB [je0020]> insert into compensation_record values('R156',50000);
Query OK, 1 row affected (0.002 sec)

MariaDB [je0020]> insert into compensation_record values('R161',75000);
Query OK, 1 row affected (0.002 sec)

MariaDB [je0020]> insert into compensation_record values('R162',5000);
Query OK, 1 row affected (0.002 sec)

MariaDB [je0020]> insert into compensation_record values('R163',10000);
Query OK, 1 row affected (0.002 sec)

MariaDB [je0020]> insert into compensation_record values('R164',100000);
Query OK, 1 row affected (0.002 sec)

MariaDB [je0020]> insert into compensation_record values('R169',90000);
Query OK, 1 row affected (0.002 sec)

MariaDB [je0020]> select * from Owner;
+-----------+------+----------+-----------+
| driver_id | name | hometown | birthyear |
+-----------+------+----------+-----------+
| BR001     | Liam | patna    |      2000 |
| CG001     | Levi | raipur   |      2004 |
| JH001     | John | dhanbad  |      2000 |
| MP001     | Jack | ujjain   |      2003 |
| RJ001     | Luke | kota     |      2001 |
| UP001     | Noah | kanpur   |      1995 |
| UP002     | Owen | banaras  |      1985 |
+-----------+------+----------+-----------+
7 rows in set (0.000 sec)

MariaDB [je0020]> select * from accident_record;
+---------------+---------------+----------+-----------+
| report_number | accident_year | location | driver_id |
+---------------+---------------+----------+-----------+
| R141          |          2010 | patna    | BR001     |
| R146          |          2011 | kanpur   | UP001     |
| R151          |          2015 | dhanbad  | JH001     |
| R156          |          2017 | kota     | UP001     |
| R161          |          2018 | raipur   | UP002     |
| R162          |          2018 | gaya     | RJ001     |
| R163          |          2020 | lucknow  | MP001     |
| R164          |          2021 | kota     | CG001     |
| R169          |          2022 | delhi    | CG001     |
+---------------+---------------+----------+-----------+
9 rows in set (0.000 sec)

MariaDB [je0020]> select * from compensation_record;
+---------------+---------------+
| report_number | damage_amount |
+---------------+---------------+
| R141          |         20000 |
| R146          |        200000 |
| R151          |        300000 |
| R156          |         50000 |
| R161          |         75000 |
| R162          |          5000 |
| R163          |         10000 |
| R164          |        100000 |
| R169          |         90000 |
+---------------+---------------+
9 rows in set (0.000 sec)

MariaDB [je0020]> ALTER TABLE Owner
    -> ADD car_model varchar(30)
    -> AFTER name;
Query OK, 0 rows affected (0.029 sec)
Records: 0  Duplicates: 0  Warnings: 0

MariaDB [je0020]> select * from Owner;
+-----------+------+-----------+----------+-----------+
| driver_id | name | car_model | hometown | birthyear |
+-----------+------+-----------+----------+-----------+
| BR001     | Liam | NULL      | patna    |      2000 |
| CG001     | Levi | NULL      | raipur   |      2004 |
| JH001     | John | NULL      | dhanbad  |      2000 |
| MP001     | Jack | NULL      | ujjain   |      2003 |
| RJ001     | Luke | NULL      | kota     |      2001 |
| UP001     | Noah | NULL      | kanpur   |      1995 |
| UP002     | Owen | NULL      | banaras  |      1985 |
+-----------+------+-----------+----------+-----------+
7 rows in set (0.001 sec)

MariaDB [je0020]> UPDATE Owner SET car_model = 'Nexon' WHERE driver_id = 'BR001';
Query OK, 1 row affected (0.004 sec)
Rows matched: 1  Changed: 1  Warnings: 0

MariaDB [je0020]> UPDATE Owner SET car_model = 'Kia. Sonet' WHERE driver_id = 'UP001';
Query OK, 1 row affected (0.002 sec)
Rows matched: 1  Changed: 1  Warnings: 0

MariaDB [je0020]> UPDATE Owner SET car_model = 'Tata. Punch' WHERE driver_id = 'JH001';
Query OK, 1 row affected (0.002 sec)
Rows matched: 1  Changed: 1  Warnings: 0

MariaDB [je0020]> UPDATE Owner SET car_model = 'Renault. Kiger' WHERE driver_id = 'UP002';
Query OK, 1 row affected (0.002 sec)
Rows matched: 1  Changed: 1  Warnings: 0

MariaDB [je0020]> UPDATE Owner SET car_model = 'Nissan. Magnite' WHERE driver_id = 'RJ001';
Query OK, 1 row affected (0.002 sec)
Rows matched: 1  Changed: 1  Warnings: 0

MariaDB [je0020]> UPDATE Owner SET car_model = 'Hyundai' WHERE driver_id = 'MP001';
Query OK, 1 row affected (0.003 sec)
Rows matched: 1  Changed: 1  Warnings: 0

MariaDB [je0020]> UPDATE Owner SET car_model = 'Mercedes-Benz' WHERE driver_id = 'CG001';
Query OK, 1 row affected (0.002 sec)
Rows matched: 1  Changed: 1  Warnings: 0

MariaDB [je0020]> select * from Owner;
+-----------+------+-----------------+----------+-----------+
| driver_id | name | car_model       | hometown | birthyear |
+-----------+------+-----------------+----------+-----------+
| BR001     | Liam | Nexon           | patna    |      2000 |
| CG001     | Levi | Mercedes-Benz   | raipur   |      2004 |
| JH001     | John | Tata. Punch     | dhanbad  |      2000 |
| MP001     | Jack | Hyundai         | ujjain   |      2003 |
| RJ001     | Luke | Nissan. Magnite | kota     |      2001 |
| UP001     | Noah | Kia. Sonet      | kanpur   |      1995 |
| UP002     | Owen | Renault. Kiger  | banaras  |      1985 |
+-----------+------+-----------------+----------+-----------+
7 rows in set (0.000 sec)

MariaDB [je0020]> SELECT COUNT(report_number)
    -> FROM accident_record
    -> WHERE accident_year=2018;
+----------------------+
| COUNT(report_number) |
+----------------------+
|                    2 |
+----------------------+
1 row in set (0.000 sec)

MariaDB [je0020]> SELECT SUM(damage_amount),AVG(damage_amount)
    -> FROM compensation_record;
+--------------------+--------------------+
| SUM(damage_amount) | AVG(damage_amount) |
+--------------------+--------------------+
|             850000 |         94444.4444 |
+--------------------+--------------------+
1 row in set (0.000 sec)

MariaDB [je0020]> SELECT location, accident_year FROM accident_record WHERE report_number='R141';
+----------+---------------+
| location | accident_year |
+----------+---------------+
| patna    |          2010 |
+----------+---------------+
1 row in set (0.000 sec)

MariaDB [je0020]> CREATE or REPLACE VIEW Query1(Driver_Id,Name,Car_Model,Report_Number,Damage_Amount)
    -> AS SELECT Owner.driver_id,Owner.name,Owner.car_model,accident_record.report_number,compensation_record.damage_amount
    -> FROM Owner,accident_record,compensation_record
    -> WHERE accident_record.accident_year > 2020 AND Owner.driver_id = accident_record.driver_id AND accident_record.report_number = compensation_record.report_number;
Query OK, 0 rows affected (0.015 sec)

MariaDB [je0020]> select * from Query1;
+-----------+------+---------------+---------------+---------------+
| Driver_Id | Name | Car_Model     | Report_Number | Damage_Amount |
+-----------+------+---------------+---------------+---------------+
| CG001     | Levi | Mercedes-Benz | R164          |        100000 |
| CG001     | Levi | Mercedes-Benz | R169          |         90000 |
+-----------+------+---------------+---------------+---------------+
2 rows in set (0.001 sec)

MariaDB [je0020]> CREATE or REPLACE VIEW Query2(Driver_Id,Driver_Name,Report_Number)
    -> AS SELECT Owner.driver_id,Owner.name,compensation_record.report_number
    -> FROM Owner,accident_record,compensation_record
    -> WHERE compensation_record.damage_amount < 210000 AND Owner.driver_id = accident_record.driver_id AND accident_record.report_number = compensation_record.report_number;
Query OK, 0 rows affected (0.013 sec)

MariaDB [je0020]> select * from Query2;
+-----------+-------------+---------------+
| Driver_Id | Driver_Name | Report_Number |
+-----------+-------------+---------------+
| BR001     | Liam        | R141          |
| UP001     | Noah        | R146          |
| UP001     | Noah        | R156          |
| UP002     | Owen        | R161          |
| RJ001     | Luke        | R162          |
| MP001     | Jack        | R163          |
| CG001     | Levi        | R164          |
| CG001     | Levi        | R169          |
+-----------+-------------+---------------+
8 rows in set (0.001 sec)

MariaDB [je0020]> UPDATE compensation_record SET damage_amount = 300000 WHERE report_number = 'R169';
Query OK, 1 row affected (0.004 sec)
Rows matched: 1  Changed: 1  Warnings: 0

MariaDB [je0020]> select * from compensation_record;
+---------------+---------------+
| report_number | damage_amount |
+---------------+---------------+
| R141          |         20000 |
| R146          |        200000 |
| R151          |        300000 |
| R156          |         50000 |
| R161          |         75000 |
| R162          |          5000 |
| R163          |         10000 |
| R164          |        100000 |
| R169          |        300000 |
+---------------+---------------+
9 rows in set (0.000 sec)

MariaDB [je0020]> SELECT Max(damage_amount), Min(damage_amount)
    -> FROM compensation_record;
+--------------------+--------------------+
| Max(damage_amount) | Min(damage_amount) |
+--------------------+--------------------+
|             300000 |               5000 |
+--------------------+--------------------+
1 row in set (0.000 sec)